{
  "name": "technical.get_active_outage",
  "version": "1.0.0",
  "description": "Trả các lịch cắt điện, nước, dịch vụ đang diễn ra hoặc sắp tới của một tòa.",
  "side_effect": "read",
  "required_capability": "technical.outage.read",
  "timeout_ms": 5000,
  "idempotent": true,
  "input_schema": {
    "type": "object",
    "additionalProperties": false,
    "properties": {
      "scope_id": {
        "type": "string"
      },
      "at": {
        "type": "string",
        "format": "date-time"
      }
    },
    "required": [
      "scope_id"
    ]
  },
  "output_schema": {
    "type": "object",
    "properties": {
      "outages": {
        "type": "array"
      }
    },
    "required": [
      "outages"
    ]
  },
  "data_origin": "synthetic",
  "owner_team": "Quang",
  "pack": "vinhomes"
}
